{
  "$comment": "Micro-topics — the nodes of the learning graph. Each is small enough to teach in one sitting and to assess on its own. `centrality` and `depth` are computed by scripts/build-web-data.mjs and written back here; do not hand-edit them.",
  "subject": "Claude Agent SDK",
  "sourceSection": "Section 8 · The Claude Agent SDK (08-claude-agent-sdk/notes.md)",
  "topics": [
    {
      "id": "mt_subprocess_model",
      "type": "CONCEPTUAL",
      "cluster": "cl_foundations",
      "name": "The subprocess mental model",
      "description": "The SDK spawns the Claude Code CLI as a subprocess and talks to it over a control protocol. That one fact explains why a library has permission modes, hooks, settings files, CLAUDE.md loading, and subagents.",
      "core": true,
      "estMinutes": 6,
      "evidence": [
        "Explain why a client library would have a `pathToClaudeCodeExecutable` option",
        "Predict that a Claude Code feature (settings, CLAUDE.md, subagents) is reachable from the SDK before reading its docs"
      ],
      "assessmentPrompt": "Why does the Agent SDK have permission modes and settings files at all, when the raw Messages API has neither?",
      "standards": [
        "ccaf:d1"
      ],
      "sources": [
        {
          "label": "Lesson · The second engine",
          "href": "../lessons/0010-claude-agent-sdk-orchestration.html#scene0"
        },
        {
          "label": "Notes · Part 1",
          "href": "../08-claude-agent-sdk/notes.md"
        }
      ],
      "centrality": 0.698,
      "layer": 1
    },
    {
      "id": "mt_loop_ownership",
      "type": "CONCEPTUAL",
      "cluster": "cl_foundations",
      "name": "Mechanism vs. policy: what you stop writing",
      "description": "In the hand-rolled loop you own stop_reason checks, tool dispatch, tool_result blocks, and the re-call. The SDK owns all of it and hands you a message stream. What you own shifts from mechanism to policy: which tools exist, who may call them, when to stop, what runs around each call.",
      "core": true,
      "estMinutes": 7,
      "evidence": [
        "Name the four steps of the hand-rolled loop the SDK absorbs",
        "Classify a given concern as mechanism (SDK's) or policy (yours)"
      ],
      "assessmentPrompt": "You move a working hand-rolled agent onto the Agent SDK. Which of your code disappears, and which of it becomes configuration?",
      "standards": [
        "ccaf:d1"
      ],
      "sources": [
        {
          "label": "Lesson · The loop is no longer yours",
          "href": "../lessons/0010-claude-agent-sdk-orchestration.html#scene1"
        }
      ],
      "centrality": 1,
      "layer": 0
    },
    {
      "id": "mt_entry_points",
      "type": "FACTUAL",
      "cluster": "cl_foundations",
      "name": "Packages, entry points, and options types",
      "description": "TypeScript `@anthropic-ai/claude-agent-sdk` with `query({ prompt, options })` and the `Options` type; Python `claude-agent-sdk` with `query(prompt=..., options=...)` and `ClaudeAgentOptions`. TypeScript adds `startup()` → `WarmQuery` to pre-spawn the subprocess (60,000 ms default initialize timeout).",
      "core": true,
      "estMinutes": 6,
      "evidence": [
        "Recall both package names and both options type names without hedging",
        "Say what `startup()` buys you and what it costs"
      ],
      "assessmentPrompt": "Name the package and the options type for each language, and say what pre-warming does.",
      "standards": [
        "ccaf:d1"
      ],
      "sources": [
        {
          "label": "Notes · Installation and entry points",
          "href": "../08-claude-agent-sdk/notes.md"
        }
      ],
      "centrality": 0.651,
      "layer": 1
    },
    {
      "id": "mt_query_vs_client",
      "type": "PROCEDURAL",
      "cluster": "cl_foundations",
      "name": "query() vs. ClaudeSDKClient",
      "description": "`query()` opens a new session per call, handles one exchange, and cannot be interrupted. `ClaudeSDKClient` (Python) reuses one session across exchanges, is manually connected, and supports interrupts. Rule of thumb: if the next action depends on Claude's response, or you need to interrupt, use the client.",
      "core": true,
      "estMinutes": 8,
      "evidence": [
        "Pick the right entry point from a described workload",
        "Name the two capabilities `query()` cannot provide"
      ],
      "assessmentPrompt": "A support console needs to interrupt a long-running agent when the customer hangs up. Which entry point, and why?",
      "standards": [
        "ccaf:d1",
        "ccaf:d5"
      ],
      "sources": [
        {
          "label": "Notes · query() versus ClaudeSDKClient",
          "href": "../08-claude-agent-sdk/notes.md"
        }
      ],
      "centrality": 0.419,
      "layer": 2
    },
    {
      "id": "mt_system_prompt",
      "type": "PROCEDURAL",
      "cluster": "cl_foundations",
      "name": "The system prompt is minimal by default",
      "description": "Omitting `systemPrompt` gives a minimal prompt, not Claude Code's. `{ type: 'preset', preset: 'claude_code' }` opts into the full one; `append` extends it; `excludeDynamicSections: true` moves per-session context into the first user message so the prompt cache survives across machines.",
      "core": true,
      "estMinutes": 7,
      "evidence": [
        "Predict the behaviour difference between an SDK agent and the Claude Code CLI on the same prompt",
        "Choose the right systemPrompt shape for a custom product agent vs. a coding agent"
      ],
      "assessmentPrompt": "Your SDK agent behaves nothing like Claude Code on the same task. What is the first option you check?",
      "standards": [
        "ccaf:d1",
        "ccaf:d3"
      ],
      "sources": [
        {
          "label": "Notes · The system prompt is minimal by default",
          "href": "../08-claude-agent-sdk/notes.md"
        }
      ],
      "centrality": 0.209,
      "layer": 2
    },
    {
      "id": "mt_setting_sources",
      "type": "PROCEDURAL",
      "cluster": "cl_foundations",
      "name": "settingSources and CLAUDE.md loading",
      "description": "`user` → ~/.claude/settings.json, `project` → .claude/settings.json, `local` → .claude/settings.local.json. Omitted loads all three; `[]` disables all three (endpoint-managed policy still loads). Project CLAUDE.md loads only when `\"project\"` is present. Python ≤ 0.1.59 treated `[]` as omitted.",
      "core": true,
      "estMinutes": 8,
      "evidence": [
        "Diagnose \"the agent ignores our CLAUDE.md\" from an options object",
        "Justify `settingSources: []` for a deployed product"
      ],
      "assessmentPrompt": "An SDK app ignores the repo's CLAUDE.md. What is the most likely cause and the fix?",
      "standards": [
        "ccaf:d1",
        "ccaf:d4"
      ],
      "sources": [
        {
          "label": "Lesson · It's ignoring our CLAUDE.md",
          "href": "../lessons/0010-claude-agent-sdk-orchestration.html#scene2"
        }
      ],
      "centrality": 0.372,
      "layer": 2
    },
    {
      "id": "mt_budgets",
      "type": "PROCEDURAL",
      "cluster": "cl_foundations",
      "name": "Budgets, stopping, and structured output",
      "description": "`maxTurns` caps agentic round trips, `maxBudgetUsd` stops on a client-side cost estimate, `taskBudget: { total }` is an API-side token budget the model is told about so it can pace itself, `abortController` cancels, and `outputFormat: { type: 'json_schema', schema }` shapes the final result.",
      "core": true,
      "estMinutes": 8,
      "evidence": [
        "Distinguish caps that cut the model off from budgets the model can plan against",
        "Pick the right stop control for a described failure mode"
      ],
      "assessmentPrompt": "Which budget option does the model itself know about, and why does that matter?",
      "standards": [
        "ccaf:d1",
        "ccaf:d5"
      ],
      "sources": [
        {
          "label": "Lesson · What stops it?",
          "href": "../lessons/0010-claude-agent-sdk-orchestration.html#scene3"
        }
      ],
      "centrality": 0.023,
      "layer": 1
    },
    {
      "id": "mt_subagent_why",
      "type": "CONCEPTUAL",
      "cluster": "cl_subagents",
      "name": "Why reach for a subagent",
      "description": "Four reasons: context isolation (verbose exploration stays out of the main window), parallelization (independent subtasks finish in the time of the slowest), specialized instructions, and tool restriction. A tool left out of a subagent's `tools` isn't in its session at all.",
      "core": true,
      "estMinutes": 7,
      "evidence": [
        "Give the reason a particular delegation is worth its overhead",
        "Reject delegation when none of the four reasons applies"
      ],
      "assessmentPrompt": "Name a case where delegating to a subagent makes the system worse, and a case where it is the only good option.",
      "standards": [
        "ccaf:d1",
        "ccaf:d5"
      ],
      "sources": [
        {
          "label": "Lesson · One agent, reading everything",
          "href": "../lessons/0010-claude-agent-sdk-orchestration.html#scene4"
        }
      ],
      "centrality": 0.349,
      "layer": 1
    },
    {
      "id": "mt_subagent_definition_sources",
      "type": "FACTUAL",
      "cluster": "cl_subagents",
      "name": "Three ways to define a subagent",
      "description": "Programmatically via the `agents` option (recommended for SDK apps), from markdown files in .claude/agents/, or the built-in `general-purpose` agent which needs no definition. Programmatic definitions take precedence over filesystem agents of the same name.",
      "core": true,
      "estMinutes": 5,
      "evidence": [
        "State which definition wins on a name collision",
        "Choose a definition source for a shipped product vs. a repo convention"
      ],